{
  "schema_version": 1,
  "content_version": "fp.1.0.0",
  "release_stage": "fp",
  "required_content_ids": [
    "ability.arbalist.grave_mark",
    "ability.arbalist.primary_crossbow",
    "ability.arbalist.slipstep",
    "ability.arbalist.stillness",
    "arena.prototype.bell_laboratory_01",
    "boss.prototype.bell_proctor",
    "class.grave_arbalist",
    "consumable.red_tonic",
    "enemy.bell_reed",
    "enemy.chain_sentry",
    "enemy.drowned_pilgrim",
    "item.prototype.armor.parish_leather",
    "item.prototype.armor.reedcloth_wraps",
    "item.prototype.armor.saltglass_coat",
    "item.prototype.charm.still_eye",
    "item.prototype.charm.undertaker_knot",
    "item.prototype.relic.dented_scope",
    "item.prototype.relic.mark_lens",
    "item.prototype.relic.slip_clasp",
    "item.prototype.weapon.grave_repeater",
    "item.prototype.weapon.longbolt_crossbow",
    "item.prototype.weapon.pine_crossbow",
    "item.prototype.weapon.scatterbow",
    "pattern.enemy.bell_reed.gap_ring",
    "pattern.enemy.chain_sentry.cross_lanes",
    "pattern.enemy.drowned_pilgrim.fan",
    "pattern.prototype.bell_proctor.aimed_fan",
    "pattern.prototype.bell_proctor.cross_lanes",
    "pattern.prototype.bell_proctor.gap_ring",
    "reward.prototype.boss",
    "reward.prototype.normal_enemy",
    "reward.prototype.wave_1",
    "reward.prototype.wave_2",
    "reward.prototype.wave_3"
  ]
}
